,Question,Numbers,Equation,Answer,group_nums,Grade,Type,Body,Ques_Statement
245,if the all the participants found a total number0 eggs from the club house number1 eggs from the park and number2 eggs from the town hall how many easter eggs were found that day ?,40 25 15,+ + number0 number1 number2,80.0,"[32, 33, 5, 7, 8, 9, 13, 14, 15, 19, 20, 21, 27, 31]",3,Sum,if the all the participants found a total number0 eggs from the club house number1 eggs from the park and number2 eggs from the town hall,how many easter eggs were found that day ?
246,penny 's class is going to animaland the largest zoo on earth for their science field trip . the zoo has a variety of wild animals in captivity . their first destination was the aviary . the aviary has number0 species of eagles on show that day . they have number1 bald eagles number2 harpy eagles and number3 crowned eagles . how many eagles are on display that day ?,3 20 15 30,+ + number1 number2 number3,65.0,"[1, 2, 5, 10, 38, 39, 40, 49, 50, 51, 52, 53, 54, 55, 56, 57, 58, 59, 66, 67, 68]",3,Sum,penny 's class is going to animaland the largest zoo on earth for their science field trip . the zoo has a variety of wild animals in captivity . their first destination was the aviary . the aviary has number0 species of eagles on show that day . they have number1 bald eagles number2 harpy eagles and number3 crowned eagles .,how many eagles are on display that day ?
247,after the aviary was the zoo 's swamp area . penny counted a total of number0 tree frogs number1 poison frogs and number2 wood frogs . how many frogs was penny able to count ?,55 10 13,+ + number0 number1 number2,78.0,"[32, 1, 33, 5, 14, 15, 16, 17, 18, 19, 20, 21, 22, 23, 24, 31]",3,Sum,after the aviary was the zoo 's swamp area . penny counted a total of number0 tree frogs number1 poison frogs and number2 wood frogs .,how many frogs was penny able to count ?
248,aside from frogs the swamp area is also home to a few dangerous animals . penny 's teacher pointed out number0 crocodiles number1 alligators and number2 vipers . how many dangerous animals did the teacher point out in total ?,22 23 5,+ + number0 number1 number2,50.0,"[3, 36, 37, 38, 19, 20, 21, 22, 23, 24, 25, 26]",3,Sum,aside from frogs the swamp area is also home to a few dangerous animals . penny 's teacher pointed out number0 crocodiles number1 alligators and number2 vipers .,how many dangerous animals did the teacher point out in total ?
249,next in their itinerary was the insectarium home to hundreds of insect species . penny who likes butterflies and ants took pictures of the different species . she was able to capture number0 species of butterflies number1 species of ants and number2 species of other insects . how many species of insects did penny capture ?,60 15 20,+ + number0 number1 number2,95.0,"[32, 33, 1, 35, 36, 37, 4, 7, 40, 41, 42, 11, 10, 52, 53, 54, 31]",3,Sum,next in their itinerary was the insectarium home to hundreds of insect species . penny who likes butterflies and ants took pictures of the different species . she was able to capture number0 species of butterflies number1 species of ants and number2 species of other insects .,how many species of insects did penny capture ?
250,last stop in their field trip was the aquarium . penny identified number0 species of sharks number1 species of eels and number2 different species of whales . how many species was penny able to identify ?,35 15 5,+ + number0 number1 number2,55.0,"[32, 1, 33, 34, 5, 11, 12, 13, 15, 16, 17, 20, 21, 22, 23]",3,Sum,last stop in their field trip was the aquarium . penny identified number0 species of sharks number1 species of eels and number2 different species of whales .,how many species was penny able to identify ?
251,marcus and his friends are starting a recycling project to help the school raise some money for charity . they were tasked to collect different materials and create useful things from those . if marcus was able to gather number0 milk bottles and john was able to gather number1 milk bottles how many milk bottles do they have available for recycling ?,25 20,+ number1 number0,45.0,"[5, 38, 39, 40, 41, 14, 47, 48, 49, 50, 19, 25, 58, 59, 60]",3,Addition,marcus and his friends are starting a recycling project to help the school raise some money for charity . they were tasked to collect different materials and create useful things from those . if marcus was able to gather number0 milk bottles and john was able to gather number1 milk bottles,how many milk bottles do they have available for recycling ?
252,chris tasked to lead the newspaper collection was able to obtain number0 newspapers from their neighborhood . if his sister lily helped him and was able to get number1 more newspapers from another block how many newspapers were they able to collect together ?,42 23,+ number0 number1,65.0,"[40, 41, 10, 11, 12, 42, 18, 22, 27, 28, 29, 30]",3,Addition,chris tasked to lead the newspaper collection was able to obtain number0 newspapers from their neighborhood . if his sister lily helped him and was able to get number1 more newspapers from another block,how many newspapers were they able to collect together ?
253,andy another part of the recycling team decided he would gather tin foil wrappers . if he was able to pick up number0 wrappers around the village dumpster and his best friend max was able to collect number1 how many wrappers were gathered in total ?,34 15,+ number0 number1,49.0,"[36, 37, 38, 5, 10, 42, 43, 44, 21, 22, 23, 24]",3,Addition,andy another part of the recycling team decided he would gather tin foil wrappers . if he was able to pick up number0 wrappers around the village dumpster and his best friend max was able to collect number1,how many wrappers were gathered in total ?
254,after collecting materials they started making recycled products to sell during the school 's recycling fair . if marcus made number0 pen holders from the milk bottles and annie was able to make number1 how many pen holders were made ?,26 37,+ number0 number1,63.0,"[32, 33, 34, 2, 37, 38, 39, 18, 19, 20, 21, 22]",3,Addition,after collecting materials they started making recycled products to sell during the school 's recycling fair . if marcus made number0 pen holders from the milk bottles and annie was able to make number1,how many pen holders were made ?
255,if the group was able to make number0 recycled materials from what they gathered and the teachers were able to make number1 how many recycled products will they be able to sell at the fair ?,65 28,+ number0 number1,93.0,"[32, 33, 34, 6, 7, 8, 9, 20, 21, 22]",3,Addition,if the group was able to make number0 recycled materials from what they gathered and the teachers were able to make number1,how many recycled products will they be able to sell at the fair ?
256,robyn and lucy are members of their village 's girl scout troop . during weekends and some weekdays they go around selling cookies in the neighborhood . they have a week before the month ends and they are doing their best to get a badge from selling cookies . working overtime robyn sold number0 packs of cookies while lucy sold number1 how many packs of cookies were they able to sell that day ?,47 29,+ number0 number1,76.0,"[1, 3, 70, 7, 71, 72, 52, 53, 54, 59, 60, 61]",3,Addition,robyn and lucy are members of their village 's girl scout troop . during weekends and some weekdays they go around selling cookies in the neighborhood . they have a week before the month ends and they are doing their best to get a badge from selling cookies . working overtime robyn sold number0 packs of cookies while lucy sold number1 how,many packs of cookies were they able to sell that day ?
257,because of an upcoming exam robyn will not be able to sell cookies on tuesday . to make up for it lucy decided to do double the work to catch up . she sold number0 cookies on her first round and number1 on her second round . how many cookies were sold by lucy ?,34 27,+ number0 number1,61.0,"[33, 34, 35, 1, 40, 41, 42, 11, 51, 52, 53]",3,Addition,because of an upcoming exam robyn will not be able to sell cookies on tuesday . to make up for it lucy decided to do double the work to catch up . she sold number0 cookies on her first round and number1 on her second round .,how many cookies were sold by lucy ?
258,still a little behind robyn asked her mother to drive them around town on wednesday to cover more houses . that day robyn sold number0 packs of cookies while lucy sold number1 how many packs were they able to sell that day ?,55 43,+ number0 number1,98.0,"[32, 1, 3, 5, 39, 40, 41, 23, 24, 25, 30, 31]",3,Addition,still a little behind robyn asked her mother to drive them around town on wednesday to cover more houses . that day robyn sold number0 packs of cookies while lucy sold number1 how,many packs were they able to sell that day ?
259,with the end of the month coming in number0 days they decided to sell cookies to the neighboring villages as well . if they sold number1 packs on number2 village and number3 on the other how many cookies were they able to sell in the other villages ?,2 23 1 28,+ number1 number3,51.0,"[32, 2, 7, 8, 9, 44, 45, 46, 24, 25, 26, 27, 28, 29, 30, 31]",3,Addition,with the end of the month coming in number0 days they decided to sell cookies to the neighboring villages as well . if they sold number1 packs on number2 village and number3 on the other,how many cookies were they able to sell in the other villages ?
260,on the day of the awarding ceremony robyn and lucy decided to sell more cookies during the morning to make sure they get the badge . lucy sold number0 packs and robyn sold number1 how many packs did they sell on their last day ?,19 16,+ number0 number1,35.0,"[32, 33, 34, 1, 5, 41, 42, 43, 27, 28, 29]",3,Addition,on the day of the awarding ceremony robyn and lucy decided to sell more cookies during the morning to make sure they get the badge . lucy sold number0 packs and robyn sold number1 how,many packs did they sell on their last day ?
261,it 's earth awareness day and the town of flora is celebrating by planting trees in areas where the forest has been damaged . mayor fauna leader of the town of flora donated number0 oak tree seedlings and number1 seedlings of holly . how many seedlings did he donate altogether ?,27 16,+ number0 number1,43.0,"[32, 33, 34, 1, 36, 37, 38, 39, 8, 5, 47, 48, 49]",3,Addition,it 's earth awareness day and the town of flora is celebrating by planting trees in areas where the forest has been damaged . mayor fauna leader of the town of flora donated number0 oak tree seedlings and number1 seedlings of holly .,how many seedlings did he donate altogether ?
262,mr. fortree a businessman also gave seedlings for the tree planting activity . if he gave number0 seedlings of cedar and number1 seedlings of pine how many seedlings did he give in total ?,14 38,+ number0 number1,52.0,"[32, 2, 5, 13, 15, 16, 17, 20, 21, 22, 30, 31]",3,Addition,mr. fortree a businessman also gave seedlings for the tree planting activity . if he gave number0 seedlings of cedar and number1 seedlings of pine,how many seedlings did he give in total ?
263,students from flora middle school were asked to participate in the event . they planted number0 apple trees and number1 orange trees in the forest near their school . how many trees in total did the students plant ?,47 27,+ number0 number1,74.0,"[1, 35, 36, 37, 7, 8, 14, 15, 16, 17, 18, 19, 20, 21]",3,Addition,students from flora middle school were asked to participate in the event . they planted number0 apple trees and number1 orange trees in the forest near their school .,how many trees in total did the students plant ?
264,rangers from flora natural park and wildlife reserve also joined the activities on that day . they planted number0 redwood trees and number1 cypress trees to replace the trees that were destroyed during a recent forest fire . how many trees did the rangers plant ?,75 25,+ number1 number0,100.0,"[1, 6, 10, 42, 43, 44, 17, 18, 19, 20, 21, 22, 23, 24]",3,Addition,rangers from flora natural park and wildlife reserve also joined the activities on that day . they planted number0 redwood trees and number1 cypress trees to replace the trees that were destroyed during a recent forest fire .,how many trees did the rangers plant ?
265,professor treehead of the flora university requested his students to participate . he said that they planted number0 species of trees in the natural park number1 species of trees in the neighboring forest and number2 species of trees all around different locations in town . how many species of trees were planted by the students ?,15 20 10,+ + number0 number2 number1,45.0,"[33, 34, 35, 4, 1, 16, 17, 18, 52, 53, 54, 24, 25, 26]",3,Sum,professor treehead of the flora university requested his students to participate . he said that they planted number0 species of trees in the natural park number1 species of trees in the neighboring forest and number2 species of trees all around different locations in town .,how many species of trees were planted by the students ?
266,hazel and her father both love going on fishing trips . this year they planned to go around the great lakes for a unique fishing experience . their first stop is lake ontario . hazel and her father decided to have a contest between them . if hazel caught number0 salmons and her dad caught number1 how many salmons did they catch in total ?,24 27,+ number0 number1,51.0,"[2, 11, 15, 48, 49, 50, 54, 55, 56, 61, 62, 63]",3,Addition,hazel and her father both love going on fishing trips . this year they planned to go around the great lakes for a unique fishing experience . their first stop is lake ontario . hazel and her father decided to have a contest between them . if hazel caught number0 salmons and her dad caught number1,how many salmons did they catch in total ?
267,their next destination is lake erie . still in a contest hazel caught number0 different fishes while her father caught number1 how many fishes did they catch in lake erie ?,48 46,+ number0 number1,94.0,"[1, 5, 7, 12, 13, 14, 15, 19, 20, 21, 27, 28, 29]",3,Addition,their next destination is lake erie . still in a contest hazel caught number0 different fishes while her father caught number1 how,many fishes did they catch in lake erie ?
268,the following week they decided to go to lake huron and lake michigan . during their stay there they caught a total of number0 pikes number1 sturgeons and number2 herrings . how many fishes did they catch from the number3 lakes ?,30 40 75 2,+ + number0 number1 number2,145.0,"[38, 39, 40, 22, 23, 24, 25, 26, 27, 28, 29]",3,Sum,the following week they decided to go to lake huron and lake michigan . during their stay there they caught a total of number0 pikes number1 sturgeons and number2 herrings .,how many fishes did they catch from the number3 lakes ?
269,being concerned with the ecology of lakes hazel and her dad returned the youngling fishes they caught . if they took number0 fishes from lake ontario and erie number1 fishes from lake huron and michigan and number2 from lake superior how many fishes will they bring home with them ?,23 30 44,+ + number0 number1 number2,97.0,"[2, 35, 36, 37, 11, 46, 47, 48, 20, 21, 22, 23, 27, 28, 29]",3,Sum,being concerned with the ecology of lakes hazel and her dad returned the youngling fishes they caught . if they took number0 fishes from lake ontario and erie number1 fishes from lake huron and michigan and number2 from lake superior,how many fishes will they bring home with them ?
270,it is buddy 's first day at a new school and he is feeling very nervous . his day begins with some bacon and egg prepared by his mother . after eating and preparing buddy headed out to catch the school bus from the nearest bus stop . including buddy there were number0 students that got on the bus during the first stop . if number1 more students got on the bus at the second stop how many students are riding the bus ?,39 29,+ number0 number1,68.0,"[64, 65, 66, 67, 3, 2, 4, 13, 16, 80, 81, 51, 52, 53, 82]",3,Addition,it is buddy 's first day at a new school and he is feeling very nervous . his day begins with some bacon and egg prepared by his mother . after eating and preparing buddy headed out to catch the school bus from the nearest bus stop . including buddy there were number0 students that got on the bus during the first stop . if number1 more students got on the bus at the second stop,how many students are riding the bus ?
271,upon arriving at the school buddy immediately went to his teacher where he was introduced to all the third grade students in the school . there were number0 girl students and number1 boy students . how many third graders did buddy meet in the school ?,57 66,+ number0 number1,123.0,"[32, 1, 42, 43, 44, 26, 27, 28, 29, 30, 31]",3,Addition,upon arriving at the school buddy immediately went to his teacher where he was introduced to all the third grade students in the school . there were number0 girl students and number1 boy students .,how many third graders did buddy meet in the school ?
272,after recess buddy changed clothes for gym class . down at the gym all the students were divided into number0 groups . if number1 group has number2 members and the other has number3 how many students are in buddy 's gym class ?,2 1 34 37,+ number2 number3,71.0,"[32, 33, 3, 39, 40, 41, 18, 19, 20, 22, 23, 24, 25, 26, 27, 31]",3,Addition,after recess buddy changed clothes for gym class . down at the gym all the students were divided into number0 groups . if number1 group has number2 members and the other has number3,how many students are in buddy 's gym class ?
273,after the final bell rang buddy ran to the school bus with his new friends . on his ride home he counted number0 students sitting on the left side of the bus and number1 sitting on the right . how many students are on the bus ride home ?,36 27,+ number0 number1,63.0,"[32, 33, 34, 1, 5, 7, 45, 46, 47, 21, 22, 23]",3,Addition,after the final bell rang buddy ran to the school bus with his new friends . on his ride home he counted number0 students sitting on the left side of the bus and number1 sitting on the right .,how many students are on the bus ride home ?
274,helen the hippo and her friends are preparing for thanksgiving at helen 's house . helen baked number0 chocolate chip cookies yesterday and number1 cookies this morning . how many cookies did helen bake ?,435 139,+ number0 number1,574.0,"[32, 1, 33, 5, 16, 17, 18, 20, 22, 23, 24, 31]",3,Addition,helen the hippo and her friends are preparing for thanksgiving at helen 's house . helen baked number0 chocolate chip cookies yesterday and number1 cookies this morning .,how many cookies did helen bake ?
275,pinky the pig bought number0 apples while danny the duck bought number1 how many apples do they have altogether ?,36 73,+ number0 number1,109.0,"[1, 3, 4, 5, 10, 11, 12, 16, 17, 18]",3,Addition,pinky the pig bought number0 apples while danny the duck bought number1 how,many apples do they have altogether ?
276,dylan the dog prepared number0 hotdog sticks in a brown bag . his father placed number1 more hotdog sticks in the same brown bag . how many hotdog sticks did dylan and his father place in the brown bag ?,241 426,+ number0 number1,667.0,"[1, 2, 3, 4, 5, 6, 36, 37, 38, 14, 15, 16, 18]",3,Addition,dylan the dog prepared number0 hotdog sticks in a brown bag . his father placed number1 more hotdog sticks in the same brown bag .,how many hotdog sticks did dylan and his father place in the brown bag ?
277,helen 's mother brought number0 hotdogs . after a few hours dylan 's mother arrived with number1 hotdogs . how many hotdogs do they have altogether ?,101 379,+ number0 number1,480.0,"[1, 3, 4, 5, 15, 16, 17, 23, 24, 25]",3,Addition,helen 's mother brought number0 hotdogs . after a few hours dylan 's mother arrived with number1 hotdogs .,how many hotdogs do they have altogether ?
278,pinky made number0 miniature pumpkin pies for everyone and helen made number1 how many miniature pies do they have in total ?,147 56,+ number0 number1,203.0,"[1, 2, 3, 5, 6, 10, 11, 12, 18, 19, 20]",3,Addition,pinky made number0 miniature pumpkin pies for everyone and helen made number1 how,many miniature pies do they have in total ?
279,it 's spring break at rosewood high so rachel and her family decided to take a trip across europe . since rachel has always been fascinated by the french people they began their tour with a visit to france . during their stay there rachel went to the famous eiffel tower . if she climbed number0 flights of stairs going up and number1 going down what is the total number of steps that she took ?,567 325,+ number0 number1,892.0,"[2, 72, 73, 74, 54, 55, 56, 61, 62, 63]",3,Addition,it 's spring break at rosewood high so rachel and her family decided to take a trip across europe . since rachel has always been fascinated by the french people they began their tour with a visit to france . during their stay there rachel went to the famous eiffel tower . if she climbed number0 flights of stairs going up and number1 going down,what is the total number of steps that she took ?
280,after visiting france rachel 's sister bella requested that they see the buckingham palace in london . if they travelled number0 miles by land and number1 miles by sea across the english channel what is the total distance that they travelled ?,451 150,+ number0 number1,601.0,"[2, 38, 39, 40, 19, 20, 21, 24, 25, 26]",3,Addition,after visiting france rachel 's sister bella requested that they see the buckingham palace in london . if they travelled number0 miles by land and number1 miles by sea across the english channel,what is the total distance that they travelled ?
281,the very first thing that rachel tried when they reached england was the food . if she ate number0 grams of bacon and number1 grams of sausages how much food did she eat in total ?,276 147,+ number0 number1,423.0,"[32, 33, 2, 34, 17, 18, 19, 22, 23, 24]",3,Addition,the very first thing that rachel tried when they reached england was the food . if she ate number0 grams of bacon and number1 grams of sausages,how much food did she eat in total ?
282,after eating a hearty meal they went to see the buckingham palace . there rachel learned that number0 visitors came to the palace that day . if there were number1 visitors the previous day how many visited the palace within number2 days ?,583 246 2,+ number0 number1,829.0,"[2, 6, 39, 40, 41, 16, 17, 18, 28, 29, 30]",3,Addition,after eating a hearty meal they went to see the buckingham palace . there rachel learned that number0 visitors came to the palace that day . if there were number1 visitors the previous day,how many visited the palace within number2 days ?
283,the last stop of their tour was italy ; there they visited naples the place where modern pizza was invented . during their stay there she ate number0 grams of pizza and her sister ate number1 how many grams of pizza did rachel and bella ate there ?,598 354,+ number0 number1,952.0,"[1, 34, 35, 36, 5, 9, 44, 45, 46, 26, 27, 28]",3,Addition,the last stop of their tour was italy ; there they visited naples the place where modern pizza was invented . during their stay there she ate number0 grams of pizza and her sister ate number1 how,many grams of pizza did rachel and bella ate there ?
284,christmas is near . mr. anderson president of nice people inc. organized a charity event to share happiness to the less fortunate people . the first thing that he did is to visit an orphanage . there he dressed up as santa and gave toys to the children . if he gave number0 toy cars to the boys and number1 dolls to the girls how many toys did he give to all ?,134 269,+ number0 number1,403.0,"[2, 69, 70, 71, 51, 52, 53, 54, 58, 59, 60]",3,Addition,christmas is near . mr. anderson president of nice people inc. organized a charity event to share happiness to the less fortunate people . the first thing that he did is to visit an orphanage . there he dressed up as santa and gave toys to the children . if he gave number0 toy cars to the boys and number1 dolls to the girls,how many toys did he give to all ?
285,next on his list is the nursing home near his office . there he number0 boxes of vitamins and number1 boxes of supplements . how many boxes of medicine did the nursing home receive from mr. anderson ?,472 288,+ number0 number1,760.0,"[1, 34, 35, 36, 5, 13, 14, 15, 18, 19, 20]",3,Addition,next on his list is the nursing home near his office . there he number0 boxes of vitamins and number1 boxes of supplements .,how many boxes of medicine did the nursing home receive from mr. anderson ?
286,feeling good about what he did mr. anderson decided to continue giving to others . he went around the city and gave clothes to homeless people . if he gave number0 shirts and number1 trousers how many pieces of clothing did he gave out in total ?,589 345,+ number0 number1,934.0,"[32, 33, 34, 35, 2, 43, 44, 45, 30, 31]",3,Addition,feeling good about what he did mr. anderson decided to continue giving to others . he went around the city and gave clothes to homeless people . if he gave number0 shirts and number1 trousers,how many pieces of clothing did he gave out in total ?
287,after giving out clothes he invited the homeless to the nearest soup kitchen to give them a proper meal . if he fed number0 men and number1 women how many homeless people was he able to feed ?,219 328,+ number0 number1,547.0,"[2, 34, 35, 36, 22, 23, 24, 25, 26, 27]",3,Addition,after giving out clothes he invited the homeless to the nearest soup kitchen to give them a proper meal . if he fed number0 men and number1 women,how many homeless people was he able to feed ?
