,Question,Numbers,Equation,Answer,group_nums,Grade,Type,Body,Ques_Statement
425,when they arrived at happyland they immediately went in and bought their tickets . if each ticket cost $ number0 and they bought number1 tickets how much did they spend on tickets ?,17.00 8,* number0 number1,136.0,"[3, 8, 10, 15, 18, 19, 20, 22, 23, 24, 29, 30, 31]",3,Multiplication,when they arrived at happyland they immediately went in and bought their tickets . if each ticket cost $ number0 and they bought number1 tickets,how much did they spend on tickets ?
426,he also has a section filled with short story booklets . if each booklet has number0 pages and there are number1 booklets in the short story section how many pages will jack need to go through if he plans to read them all ?,9 49,* number0 number1,441.0,"[3, 8, 40, 41, 42, 12, 14, 15, 16, 17, 19, 20, 21]",3,Multiplication,he also has a section filled with short story booklets . if each booklet has number0 pages and there are number1 booklets in the short story section,how many pages will jack need to go through if he plans to read them all ?
427,number0 of his favorites is a book called encyclopedia of life and everything else . the book has number1 large chapters each having number2 pages . how many pages does the encyclopedia have in total ?,1 7 566,* number1 number2,3962.0,"[0, 1, 2, 32, 4, 33, 6, 7, 34, 17, 18, 19, 20, 21, 22, 23, 24]",3,Multiplication,number0 of his favorites is a book called encyclopedia of life and everything else . the book has number1 large chapters each having number2 pages .,how many pages does the encyclopedia have in total ?
428,the mini library also has a section for the classics . if jack has a collection of number0 classic authors with each author having number1 books how many books does he have in the classics section ?,6 33,* number0 number1,198.0,"[33, 34, 35, 7, 12, 16, 17, 18, 19, 20, 21, 23, 24, 25]",3,Multiplication,the mini library also has a section for the classics . if jack has a collection of number0 classic authors with each author having number1 books,how many books does he have in the classics section ?
429,allen shiela 's brother likes to play with blocks . shiela repainted allen 's old blocks in different colors . if allen has number0 identical blocks and there are number1 blocks for every color of paint used how many colors did shiela use ?,49 7,/ number0 number1,7.0,"[32, 1, 2, 4, 8, 40, 41, 42, 22, 23, 24, 25, 28, 29, 30]",3,Common-Division,allen shiela 's brother likes to play with blocks . shiela repainted allen 's old blocks in different colors . if allen has number0 identical blocks and there are number1 blocks for every color of paint used,how many colors did shiela use ?
430,aside from drawing animals shiela is fond of painting flowers . if she has number0 paintings of flowers how many paintings can she give to each of her number1 grandmothers ?,18 2,/ number0 number1,9.0,"[2, 8, 12, 13, 14, 15, 25, 27, 28, 29]",3,Common-Division,aside from drawing animals shiela is fond of painting flowers . if she has number0 paintings of flowers,how many paintings can she give to each of her number1 grandmothers ?
431,it has been tradition in shiela 's home to hang a sock above the fireplace for each member of the family . this year she placed a cinnamon ball every day in the socks for number0 of her family members . how long can she do this if she bought number1 cinnamon balls ?,5 50,/ number1 number0,10.0,"[34, 35, 36, 8, 16, 49, 50, 51, 52, 29]",3,Common-Division,it has been tradition in shiela 's home to hang a sock above the fireplace for each member of the family . this year she placed a cinnamon ball every day in the socks for number0 of her family members .,how long can she do this if she bought number1 cinnamon balls ?
432,haley loves to collect things . this year she decided to give away part of her collection as it was taking too much space in her room . number0 of her closest friends like stickers . if she plans to give all of them an equal number of stickers how many will each receive if she has number1 stickers ?,9 72,/ number1 number0,8.0,"[52, 20, 56, 57, 58, 28, 29]",3,Common-Division,haley loves to collect things . this year she decided to give away part of her collection as it was taking too much space in her room . number0 of her closest friends like stickers . if she plans to give all of them an equal number of stickers,how many will each receive if she has number1 stickers ?
433,in haley 's class number0 are boys who love to play marbles . if haley has number1 marbles how many will each of the boys receive ?,5 35,/ number1 number0,7.0,"[2, 3, 4, 5, 10, 15, 16, 17, 21, 23, 24, 25]",3,Common-Division,in haley 's class number0 are boys who love to play marbles . if haley has number1 marbles,how many will each of the boys receive ?
434,when relatives visit haley and her family she and her cousins do origami . if she has number0 origami papers to give away to her number1 cousins how many will each receive if she gives everyone the same number of origami papers ?,48 6,/ number0 number1,8.0,"[2, 7, 39, 40, 41, 16, 17, 18, 19, 24, 25, 26, 30]",3,Common-Division,when relatives visit haley and her family she and her cousins do origami . if she has number0 origami papers to give away to her number1 cousins,how many will each receive if she gives everyone the same number of origami papers ?
435,a large bag of balls was kept under haley 's bed . her mom placed the balls in bags for children in foster homes . if every bag can contain number0 balls and haley has number1 balls how many bags will be used ?,4 36,/ number1 number0,9.0,"[34, 35, 36, 2, 4, 40, 9, 41, 42, 26, 29, 30, 31]",3,Common-Division,a large bag of balls was kept under haley 's bed . her mom placed the balls in bags for children in foster homes . if every bag can contain number0 balls and haley has number1 balls,how many bags will be used ?
436,haley has number0 magazines in her cabinet . she plans to send it to the recycling office in their area . if she places it in boxes which can contain number1 magazines how many boxes will she use ?,63 9,/ number0 number1,7.0,"[1, 2, 3, 35, 36, 37, 8, 29, 30, 31]",3,Common-Division,haley has number0 magazines in her cabinet . she plans to send it to the recycling office in their area . if she places it in boxes which can contain number1 magazines,how many boxes will she use ?
437,number0 bright sunny day betty decided to make bracelets from beautiful stones she bought from a local store . she bought number1 pink flower stones and wanted to make number2 bracelets out of these stones . how many pink flower stones will each bracelet have if she used the same number of stones in each bracelet ?,1 88 8,/ number1 number2,11.0,"[0, 1, 2, 3, 7, 8, 9, 42, 10, 20, 21, 22, 54, 24, 53, 55, 28, 29, 30]",3,Common-Division,number0 bright sunny day betty decided to make bracelets from beautiful stones she bought from a local store . she bought number1 pink flower stones and wanted to make number2 bracelets out of these stones .,how many pink flower stones will each bracelet have if she used the same number of stones in each bracelet ?
438,betty also bought number0 shiny blue round stones . if number1 pieces of this stone is in each bracelet how many bracelets of blue shiny round stones will there be ?,140 14,/ number0 number1,10.0,"[2, 3, 4, 5, 6, 7, 9, 10, 11, 14, 15, 16, 17, 27, 28, 29]",3,Common-Division,betty also bought number0 shiny blue round stones . if number1 pieces of this stone is in each bracelet,how many bracelets of blue shiny round stones will there be ?
439,brenda betty 's sister wanted to have number0 bracelets with star-shaped stones . she also bought number1 star-shaped stones from the local store and gave it to betty . how many star-shaped stones will there be in each of the bracelet betty makes for brenda ?,3 36,/ number1 number0,12.0,"[1, 2, 4, 37, 6, 7, 8, 10, 42, 43, 44, 15, 16, 17, 18]",3,Common-Division,brenda betty 's sister wanted to have number0 bracelets with star-shaped stones . she also bought number1 star-shaped stones from the local store and gave it to betty .,how many star-shaped stones will there be in each of the bracelet betty makes for brenda ?
440,shannon brenda 's neighbor joined brenda in making bracelets . she brought number0 heart-shaped stones and wanted to have number1 of this type of stone in each of the bracelet she makes . how many bracelets with heart-shaped stones can shannon make ?,48 8,/ number0 number1,6.0,"[1, 4, 39, 40, 41, 11, 12, 13, 14, 18, 19, 20, 26]",3,Common-Division,shannon brenda 's neighbor joined brenda in making bracelets . she brought number0 heart-shaped stones and wanted to have number1 of this type of stone in each of the bracelet she makes .,how many bracelets with heart-shaped stones can shannon make ?
441,brenda 's mother made cookies for number0 . if she prepared number1 cookies and each of them had the same number of cookies how many did each of them have ?,5 35,/ number1 number0,7.0,"[2, 3, 5, 6, 10, 11, 12, 14, 26, 27, 28, 29]",3,Common-Division,brenda 's mother made cookies for number0 . if she prepared number1 cookies and each of them had the same number of cookies,how many did each of them have ?
442,on the first saturday of spring jane woke up early to enjoy the whole day and help with chores at home . jane had been saving large empty cans to serve as pots for sunflowers . if she has number0 sunflower seeds and there are number1 cans how many seeds will be placed in each can if she places an equal number of seeds in each can ?,54 9,/ number0 number1,6.0,"[64, 65, 2, 3, 4, 5, 38, 39, 40, 41, 8, 66, 44, 45, 46, 12, 54]",3,Common-Division,on the first saturday of spring jane woke up early to enjoy the whole day and help with chores at home . jane had been saving large empty cans to serve as pots for sunflowers . if she has number0 sunflower seeds and there are number1 cans,how many seeds will be placed in each can if she places an equal number of seeds in each can ?
443,jane 's mom picked cherry tomatoes from their backyard . if she gathered number0 cherry tomatoes and is about to place them in small jars which can contain number1 cherry tomatoes at a time how many jars will she need ?,56 8,/ number0 number1,7.0,"[2, 3, 37, 38, 39, 12, 13, 14, 15, 17, 27, 28, 29, 30]",3,Common-Division,jane 's mom picked cherry tomatoes from their backyard . if she gathered number0 cherry tomatoes and is about to place them in small jars which can contain number1 cherry tomatoes at a time,how many jars will she need ?
444,jane helped her mom prepare fresh lemonade . if each glass needs number0 lemons how many glasses of fresh lemonade can she make if they have number1 lemons ?,2 18,/ number1 number0,9.0,"[3, 9, 11, 12, 13, 17, 25, 26, 27]",3,Common-Division,jane helped her mom prepare fresh lemonade . if each glass needs number0 lemons,how many glasses of fresh lemonade can she make if they have number1 lemons ?
445,for dessert jane 's mom prepared number0 pieces of bite-size cinnamon swirls . if the number1 of them ate an equal number of pieces of cinnamon swirls how many pieces did jane eat ?,12 3,/ number0 number1,4.0,"[32, 5, 6, 7, 14, 15, 16, 19, 30, 31]",3,Common-Division,for dessert jane 's mom prepared number0 pieces of bite-size cinnamon swirls . if the number1 of them ate an equal number of pieces of cinnamon swirls,how many pieces did jane eat ?
446,marian also baked oatmeal cookies for her classmates . if she can place number0 cookies on a tray at a time how many trays will she need to prepare number1 oatmeal cookies at a time ?,12 276,/ number1 number0,23.0,"[32, 33, 2, 3, 34, 12, 13, 14, 19, 28, 29, 30, 31]",3,Common-Division,marian also baked oatmeal cookies for her classmates . if she can place number0 cookies on a tray at a time,how many trays will she need to prepare number1 oatmeal cookies at a time ?
447,marian 's friends were coming over that afternoon so she made number0 bite-sized pretzels . if number1 serving is equal to number2 pretzels how many servings of bite-sized pretzels was marian able to prepare ?,480 1 12,/ number0 number2,40.0,"[32, 33, 10, 11, 12, 13, 15, 16, 17, 19, 20, 21, 22, 27, 31]",3,Common-Division,marian 's friends were coming over that afternoon so she made number0 bite-sized pretzels . if number1 serving is equal to number2 pretzels,how many servings of bite-sized pretzels was marian able to prepare ?
448,susie and her sister gathered all number0 of their teddy bears and placed them on the shelves in their bedroom . if every shelf can carry a maximum of number1 teddy bears how many shelves will be filled ?,98 7,/ number0 number1,14.0,"[35, 36, 5, 6, 7, 37, 22, 28, 29, 30, 31]",3,Common-Division,susie and her sister gathered all number0 of their teddy bears and placed them on the shelves in their bedroom . if every shelf can carry a maximum of number1 teddy bears,how many shelves will be filled ?
449,susie 's mother collected all family pictures and wanted to place all of them in an album . if an album can contain number0 pictures how many albums will she need if there are number1 pictures ?,20 480,/ number1 number0,24.0,"[33, 34, 35, 3, 4, 15, 22, 23, 24]",3,Common-Division,susie 's mother collected all family pictures and wanted to place all of them in an album . if an album can contain number0 pictures,how many albums will she need if there are number1 pictures ?
450,susie 's father repaired the bookshelves in the reading room . if he has number0 books to be distributed equally on the number1 shelves he repaired how many books will each shelf contain ?,210 10,/ number0 number1,21.0,"[32, 2, 13, 14, 15, 16, 21, 22, 23, 30, 31]",3,Common-Division,susie 's father repaired the bookshelves in the reading room . if he has number0 books to be distributed equally on the number1 shelves he repaired,how many books will each shelf contain ?
451,matt and his friends were thinking of making christmas decors for the clubhouse in their neighborhood . they are to repaint number0 balls in number1 different colors . if they painted an equal number of balls for every color how many balls are there for each color ?,350 10,/ number0 number1,35.0,"[3, 37, 8, 12, 45, 44, 15, 46, 20, 21, 22, 23, 24, 25, 26]",3,Common-Division,matt and his friends were thinking of making christmas decors for the clubhouse in their neighborhood . they are to repaint number0 balls in number1 different colors . if they painted an equal number of balls for every color,how many balls are there for each color ?
452,they also gathered paper to create some star-shaped papier-mache . if each star requires number0 pieces of paper and they had number1 pieces of paper how many stars were they able to make ?,20 680,/ number1 number0,34.0,"[32, 3, 10, 11, 13, 14, 15, 20, 21, 22, 30, 31]",3,Common-Division,they also gathered paper to create some star-shaped papier-mache . if each star requires number0 pieces of paper and they had number1 pieces of paper,how many stars were they able to make ?
453,allen charles lex and shiela spent days reading books for their book report . the texts were printed very small so they were only able to cover very few pages a day . allen read about the solar system . he read number0 pages a day of a book which has number1 pages . how many days did it take allen to finish reading the book ?,10 120,/ number1 number0,12.0,"[64, 1, 65, 41, 42, 43, 12, 10, 14, 50, 51, 52, 63]",3,Common-Division,allen charles lex and shiela spent days reading books for their book report . the texts were printed very small so they were only able to cover very few pages a day . allen read about the solar system . he read number0 pages a day of a book which has number1 pages .,how many days did it take allen to finish reading the book ?
454,lex read a number0 page book about music and instruments . if he can read exactly number1 pages a day how many days will it take lex to finish reading the book ?,420 30,/ number0 number1,14.0,"[2, 3, 4, 15, 16, 17, 29, 30, 31]",3,Common-Division,lex read a number0 page book about music and instruments . if he can read exactly number1 pages a day,how many days will it take lex to finish reading the book ?
455,lex read another book with number0 pages . if he read the same number of pages for number1 days how many pages did he read every day ?,240 12,/ number0 number1,20.0,"[4, 5, 6, 12, 16, 17, 18, 24, 25, 26]",3,Common-Division,lex read another book with number0 pages . if he read the same number of pages for number1 days,how many pages did he read every day ?
456,liz and jenn had a book sale . they sold number0 detective books and number1 puzzle books . how many books did they sell altogether ?,27 15,+ number0 number1,42.0,"[1, 5, 9, 10, 11, 12, 13, 14, 15, 16, 22, 23, 24]",3,Addition,liz and jenn had a book sale . they sold number0 detective books and number1 puzzle books .,how many books did they sell altogether ?
457,scott and sam decided to sell their old comic books . they had number0 comic books altogether . after the sale they only had number1 comic books . how many comic books did scott and sam sell ?,90 25,- number0 number1,65.0,"[1, 2, 34, 35, 5, 36, 7, 8, 12, 13, 14, 15, 23, 24, 25, 26]",3,Subtraction,scott and sam decided to sell their old comic books . they had number0 comic books altogether . after the sale they only had number1 comic books .,how many comic books did scott and sam sell ?
458,connie saved up $ number0 . she wants to buy a watch that costs $ number1 . how much more money does connie need ?,39 55,- number1 number0,16.0,"[1, 3, 4, 13, 14, 15, 21, 22, 23]",3,Subtraction,connie saved up $ number0 . she wants to buy a watch that costs $ number1 .,how much more money does connie need ?
459,terry and grace are building a gear machine . terry used number0 building pieces . grace used number1 pieces . how many building pieces did they use altogether ?,37 45,+ number0 number1,82.0,"[1, 6, 10, 11, 12, 13, 16, 17, 18, 25, 26, 27]",3,Addition,terry and grace are building a gear machine . terry used number0 building pieces . grace used number1 pieces .,how many building pieces did they use altogether ?
460,the smart mart sells educational toys . they sold number0 science kits last week . the sold number1 fewer puzzles than science kits . how many puzzles did the smart mart sell ?,45 9,- number0 number1,36.0,"[1, 8, 9, 10, 11, 16, 17, 18, 29, 30, 31]",3,Subtraction,the smart mart sells educational toys . they sold number0 science kits last week . the sold number1 fewer puzzles than science kits .,how many puzzles did the smart mart sell ?
461,richard and bruno played miniature golf . richard 's score was number0 bruno 's score was number1 points lower than richard 's score . what was bruno 's score ?,62 14,- number0 number1,48.0,"[10, 11, 12, 16, 17, 18, 26, 27, 28]",3,Subtraction,richard and bruno played miniature golf . richard 's score was number0 bruno 's score was number1 points lower than richard 's score .,what was bruno 's score ?
462,number0 people visited the statue of liberty in the morning . number1 more people visited in the afternoon than in the morning . how many people visited the statue of liberty in the afternoon ?,35 56,+ number0 number1,91.0,"[0, 1, 2, 3, 32, 33, 11, 12, 13, 31]",3,Addition,number0 people visited the statue of liberty in the morning . number1 more people visited in the afternoon than in the morning .,how many people visited the statue of liberty in the afternoon ?
463,the giant ferris wheel can seat number0 people . there are number1 people waiting in line . how many people wo n't get on the ride this time ?,56 92,- number1 number0,36.0,"[1, 5, 6, 7, 10, 11, 12, 25, 26, 27]",3,Subtraction,the giant ferris wheel can seat number0 people . there are number1 people waiting in line .,how many people wo n't get on the ride this time ?
464,erin and dana finished a number0 day bike-a-thon . they rode number1 miles the first day the rode number2 miles the second day . how many miles did they ride altogether ?,2 37 55,+ number1 number2,92.0,"[1, 4, 5, 6, 8, 10, 11, 12, 17, 18, 19, 28, 29, 30]",3,Addition,erin and dana finished a number0 day bike-a-thon . they rode number1 miles the first day the rode number2 miles the second day .,how many miles did they ride altogether ?
465,greg wants to buy a $ number0 scooter . he has saved $ number1 so far . how much more money does greg need ?,90 57,- number0 number1,33.0,"[2, 5, 6, 7, 12, 13, 14, 21, 22, 23]",3,Subtraction,greg wants to buy a $ number0 scooter . he has saved $ number1 so far .,how much more money does greg need ?
466,chris has number0 soccer cards . his friend charlie has number1 cards . how many fewer cards does chris have ?,18 32,- number1 number0,14.0,"[1, 2, 3, 4, 6, 9, 10, 11, 17, 18, 19]",3,Subtraction,chris has number0 soccer cards . his friend charlie has number1 cards .,how many fewer cards does chris have ?
467,number0 campers went rowing in the morning . number1 campers went rowing in the afternoon . how many campers went rowing in all ?,35 27,+ number0 number1,62.0,"[0, 1, 2, 4, 5, 8, 9, 20, 21, 22]",3,Addition,number0 campers went rowing in the morning . number1 campers went rowing in the afternoon .,how many campers went rowing in all ?
468,mrs. griffin went to the grocery store with $ number0 . she had $ number1 left after shopping . how much did mrs. griffin spend ?,70 16,- number0 number1,54.0,"[8, 9, 12, 13, 14, 15, 22, 23, 24]",3,Subtraction,mrs. griffin went to the grocery store with $ number0 . she had $ number1 left after shopping .,how much did mrs. griffin spend ?
469,the library has number0 science books . the second graders borrowed number1 of them . how many science books are left ?,75 18,- number0 number1,57.0,"[1, 2, 3, 4, 5, 10, 11, 12, 18, 19, 20]",3,Subtraction,the library has number0 science books . the second graders borrowed number1 of them .,how many science books are left ?
470,the wildcats scored number0 points in the first half of the game . the panthers scored number1 points . how many more points did the wildcats score ?,36 17,- number0 number1,19.0,"[1, 2, 3, 4, 7, 15, 16, 17, 24, 25, 26]",3,Subtraction,the wildcats scored number0 points in the first half of the game . the panthers scored number1 points .,how many more points did the wildcats score ?
471,alexa and katerina stood on a scale together . the scale read number0 pounds . alexa knows she weighs number1 pounds . how much does katerina weigh ?,95 46,- number0 number1,49.0,"[2, 3, 11, 12, 13, 18, 19, 20, 24, 25, 26]",3,Subtraction,alexa and katerina stood on a scale together . the scale read number0 pounds . alexa knows she weighs number1 pounds .,how much does katerina weigh ?
472,frannie and meg are in a jump rope contest . frannie jumped number0 times without missing . she jumped number1 fewer times than meg . how many times did meg jump ?,53 18,+ number0 number1,71.0,"[1, 3, 5, 11, 12, 13, 18, 19, 20, 21, 28, 29, 30]",3,Addition,frannie and meg are in a jump rope contest . frannie jumped number0 times without missing . she jumped number1 fewer times than meg .,how many times did meg jump ?
473,the difference between number0 numbers is number1 the smaller number is number2 what is the larger number ?,2 24 46,+ number2 number1,70.0,"[2, 3, 4, 5, 6, 7, 11, 12, 13, 14, 15, 16]",3,Addition,the difference between number0 numbers is number1 the smaller number is number2 what,is the larger number ?
474,if you add number0 to a mystery number you will get number1 what is the mystery number ?,45 92,- number1 number0,47.0,"[2, 3, 4, 10, 11, 12, 14, 15, 16]",3,Subtraction,if you add number0 to a mystery number you will get number1 what,is the mystery number ?
475,sam and erica have $ number0 together . sam has $ number1 . how does erica have ?,91 38,- number0 number1,53.0,"[1, 3, 4, 5, 6, 10, 11, 14, 15, 16]",3,Subtraction,sam and erica have $ number0 together . sam has $ number1 .,how does erica have ?
476,wendy bought number0 inches of ribbon . she used number1 inches to wrap presents . how much ribbon did wendy have left ?,84 46,- number0 number1,38.0,"[1, 2, 3, 8, 9, 10, 19, 20, 21]",3,Subtraction,wendy bought number0 inches of ribbon . she used number1 inches to wrap presents .,how much ribbon did wendy have left ?
477,the grasshopper and the frog had a jumping contest . the grasshopper jumped number0 inches . the frog jumped number1 inches farther than the grasshopper . how far did the frog jump ?,25 15,+ number0 number1,40.0,"[12, 13, 14, 18, 19, 20, 29, 30, 31]",3,Addition,the grasshopper and the frog had a jumping contest . the grasshopper jumped number0 inches . the frog jumped number1 inches farther than the grasshopper .,how far did the frog jump ?
478,marco and his dad went strawberry picking . together their strawberries weighed number0 pounds . marco 's strawberries weighed number1 pounds . how much did his dad 's strawberries weigh ?,23 14,- number0 number1,9.0,"[3, 11, 12, 13, 18, 19, 20, 27, 28, 29]",3,Subtraction,marco and his dad went strawberry picking . together their strawberries weighed number0 pounds . marco 's strawberries weighed number1 pounds .,how much did his dad 's strawberries weigh ?
479,miki bought number0 packs of red bouncy balls and number1 packs of yellow bouncy balls . each package contained number2 bouncy balls . how many more packs of red bouncy balls than yellow bouncy balls did miki buy ?,4 3 7,- number0 number1,1.0,"[1, 2, 3, 4, 5, 6, 35, 8, 9, 10, 36, 12, 13, 14, 16, 18, 19, 20, 21, 37]",5,Difference,miki bought number0 packs of red bouncy balls and number1 packs of yellow bouncy balls . each package contained number2 bouncy balls .,how many more packs of red bouncy balls than yellow bouncy balls did miki buy ?
